{
  "schema_version": "v0.3",
  "experiment_id": "exp_2025_cmb_unified",
  "description": "Unified test of Boltzmann Transport with Hard Sphere Scattering Cross-Sections. Tests the hypothesis that geometry and thermodynamics are dual representations - scattering cross-section IS the form factor squared (Born approximation).",

  "model": {
    "id": "qfd.cosmo.unified",
    "variant": "transport_soliton"
  },

  "parameters": [
    {
      "name": "r_psi",
      "value": 274.0,
      "role": "coupling",
      "bounds": [50.0, 500.0],
      "units": "Mpc",
      "description": "Scattering scale (Soliton Radius or Lattice Constant). Tests if ~274 Mpc (lattice spacing) or ~147 Mpc (domain radius) emerges.",
      "prior": {"type": "uniform", "args": {"min": 50.0, "max": 500.0}}
    },
    {
      "name": "A_norm",
      "value": 5000.0,
      "role": "nuisance",
      "bounds": [100.0, 50000.0],
      "units": "uK^2",
      "description": "Thermodynamic amplitude",
      "prior": {"type": "uniform", "args": {"min": 100.0, "max": 50000.0}}
    },
    {
      "name": "alpha",
      "value": 0.0,
      "role": "coupling",
      "bounds": [-2.0, 2.0],
      "units": "dimensionless",
      "description": "Spectral tilt (Blue Interaction strength). Tests if high-frequency photons scatter more (alpha > 0).",
      "prior": {"type": "uniform", "args": {"min": -2.0, "max": 2.0}}
    },
    {
      "name": "chi_star",
      "value": 14156.0,
      "role": "coupling",
      "frozen": true,
      "units": "Mpc",
      "description": "Comoving distance to scattering shell (Mpc)"
    }
  ],

  "datasets": [
    {
      "id": "planck_2018_tt",
      "source": "../../data/raw/planck_2018_power_spectra_mock.csv",
      "columns": {
        "ell": "ell",
        "target": "C_ell_TT_LCDM",
        "sigma": "sigma_TT"
      },
      "cuts": {
        "ell": {"min": 30, "max": 2500}
      }
    }
  ],

  "objective": {
    "type": "chi_squared",
    "components": [
      {
        "dataset_id": "planck_2018_tt",
        "observable_adapter": "qfd.adapters.cosmology.cmb_boltzmann_transport.predict_cmb_transport_spectrum",
        "weight": 1.0,
        "active": true
      }
    ]
  },

  "solver": {
    "method": "scipy.minimize",
    "options": {
      "algo": "L-BFGS-B",
      "maxiter": 1000,
      "tol": 1.0e-6
    }
  }
}
